LGBMmodel/model_comparison_test.csv

,Log Return,Total Return,Annualized Return,Sharpe Ratio,Max Drawdown,Win Rate,Profit Factor,Calmar Ratio,Total Trades
original_model on original_test,2.5476693065124087,11.777289107213264,39.03395468503612,24.070424913865455,-0.3544380994578821,0.5104520278720743,2.954278753400128,110.1291163245122,6584.0
original_model on day_test,1.1244515221509175,2.0785278814289976,7.032875241624966,15.286624339098378,-0.233531938829039,0.495340299350466,2.3035216615706053,30.11526079425693,4016.0
original_model on night_test,1.4136457199339398,3.110915363678062,14.170906578545006,25.1323282811667,-0.11796077544866782,0.5303760848601736,4.522618556107241,120.13236200461961,2599.0
day_model on day_test,1.0166888904981144,1.7640275975519728,5.578881255123596,7.775609728297407,-0.3581359414202573,0.47516556291390727,1.724097090578198,15.577552012790072,4964.0
night_model on night_test,-1.6946100031635742,-0.816329153889481,-0.9616062450490829,-16.507350603416022,-0.8166652536810911,0.2979336379892708,0.46973117822732025,-1.177479072012278,7032.0

final_report.md

### 5.2 LGBM Backtesting Results

- `original_model on original_test`: log return 2.548, total return 1177.73%, Sharpe ratio 24.07, maximum drawdown -35.44%, profit factor 2.95, and 6,584 trades.
- `original_model on night_test`: log return 1.414, total return 311.09%, Sharpe ratio 25.13, maximum drawdown -11.80%, profit factor 4.52, and 2,599 trades.
- `original_model on day_test`: log return 1.124, total return 207.85%, Sharpe ratio 15.29, maximum drawdown -23.35%, profit factor 2.30, and 4,016 trades.
- `day_model on day_test`: log return 1.017, total return 176.40%, Sharpe ratio 7.78, maximum drawdown -35.81%, profit factor 1.72, and 4,964 trades.
- `night_model on night_test`: log return -1.695, total return -81.63%, Sharpe ratio -16.51, maximum drawdown -81.67%, profit factor 0.47, and 7,032 trades.